{"type":"config","name":"Gemini Mission Control shell script performance","metricName":"total_µs","metricUnit":"µs","bestDirection":"lower"}
{"run":1,"commit":"b9d8aa5","metric":319144,"metrics":{"scaffold_µs":60044,"validate_µs":23649,"session_µs":235451},"status":"keep","description":"Baseline: scaffold=60ms, validate=24ms, session=235ms","timestamp":1773366533806,"segment":0}
{"run":2,"commit":"c751465","metric":89850,"metrics":{"scaffold_µs":48003,"session_µs":24277,"validate_µs":17570},"status":"keep","description":"session-context.sh: single stat + sorted walk + 1 jq per candidate (was N×jq per dir)","timestamp":1773366608260,"segment":0}
{"run":3,"commit":"3114318","metric":69442,"metrics":{"scaffold_µs":30864,"session_µs":18990,"validate_µs":19588},"status":"keep","description":"scaffold-mission.sh: replace python3 JSON gen with pure bash heredoc + json_escape","timestamp":1773366654325,"segment":0}
{"run":4,"commit":"9cd5f32","metric":52518,"metrics":{"scaffold_µs":14379,"session_µs":20492,"validate_µs":17647},"status":"keep","description":"scaffold: printf instead of heredocs, inline json_escape, remove function overhead","timestamp":1773366710547,"segment":0}
{"run":5,"commit":"35da18d","metric":48101,"metrics":{"scaffold_µs":13183,"session_µs":19498,"validate_µs":15420},"status":"keep","description":"validate-state.sh: single jq call, emit only errors (no \"ok\" lines), remove separate JSON check","timestamp":1773366769110,"segment":0}
{"run":6,"commit":"sess2","metric":51906,"metrics":{"scaffold_µs":18390,"session_µs":16114,"validate_µs":17402},"status":"discard","description":"session-context.sh: pure bash JSON parser, eliminate jq entirely","timestamp":1773366875927,"segment":0}
{"run":7,"commit":"da33d80","metric":44252,"metrics":{"scaffold_µs":15245,"session_µs":14573,"validate_µs":14434},"status":"keep","description":"session-context.sh: pure bash JSON parser replacing jq (re-run, stable improvement)","timestamp":1773366936078,"segment":0}
{"run":8,"commit":"6769bed","metric":41072,"metrics":{"scaffold_µs":16673,"session_µs":14598,"validate_µs":9801},"status":"keep","description":"validate-state.sh: pure bash parser replacing jq — no external process spawns","timestamp":1773367010228,"segment":0}
{"run":9,"commit":"sess4","metric":43505,"metrics":{"scaffold_µs":18676,"session_µs":14841,"validate_µs":9988},"status":"discard","description":"session-context.sh: replace stat+sort with ls -t (no improvement)","timestamp":1773367082672,"segment":0}
{"type":"config","name":"Gemini Mission Control — Instruction Token Footprint Optimization","metricName":"total_bytes","metricUnit":"kb","bestDirection":"lower"}
{"run":1,"commit":"e9b7f03","metric":152320,"metrics":{"hot_path_bytes":60027,"gemini_md_bytes":20162,"orchestrator_bytes":39865,"planner_bytes":25359,"agents_bytes":33359,"commands_bytes":16185},"status":"keep","description":"Baseline: instruction token footprint — 152KB total, 60KB hot path","timestamp":1773367606234,"segment":0}
{"run":2,"commit":"23ac77b","metric":136870,"metrics":{"hot_path_bytes":44577,"gemini_md_bytes":4712,"orchestrator_bytes":39865,"planner_bytes":25359,"agents_bytes":33359,"commands_bytes":16185},"status":"keep","description":"GEMINI.md: compress from 20KB to 4.7KB — remove redundant schemas/procedures, keep references","timestamp":1773367711246,"segment":0}
{"run":3,"commit":"9e43ab7","metric":107052,"metrics":{"hot_path_bytes":14759,"gemini_md_bytes":4712,"orchestrator_bytes":10047,"planner_bytes":25359,"agents_bytes":33359,"commands_bytes":16185},"status":"keep","description":"mission-orchestrator SKILL.md: compress from 40KB to 10KB — terse imperative style, removed examples","timestamp":1773367862195,"segment":0}
{"run":4,"commit":"a77797b","metric":52774,"metrics":{"hot_path_bytes":14759,"gemini_md_bytes":4712,"orchestrator_bytes":10047,"planner_bytes":5859,"agents_bytes":11320,"commands_bytes":16185},"status":"keep","description":"Compress planner (25→6KB), worker-skills (17→5KB), all 4 agents (33→11KB)","timestamp":1773368063736,"segment":0}
{"run":5,"commit":"08df429","metric":42561,"metrics":{"hot_path_bytes":14759,"gemini_md_bytes":4712,"orchestrator_bytes":10047,"planner_bytes":5859,"agents_bytes":11320,"commands_bytes":5972},"status":"keep","description":"Compress all 9 TOML commands (16→6KB) — terse prompts preserving all logic","timestamp":1773368173382,"segment":0}
{"run":6,"commit":"a3191cd","metric":38000,"metrics":{"hot_path_bytes":14759,"gemini_md_bytes":4712,"orchestrator_bytes":10047,"planner_bytes":5859,"agents_bytes":6759,"commands_bytes":5972},"status":"keep","description":"Second-pass agent compression (11→7KB) — inline handoff JSON, strip prose","timestamp":1773368292058,"segment":0}
{"run":7,"commit":"orch2","metric":33180,"metrics":{"hot_path_bytes":9939,"gemini_md_bytes":4712,"orchestrator_bytes":5227,"planner_bytes":5859,"agents_bytes":6759,"commands_bytes":5972},"status":"discard","description":"Over-compressed orchestrator to 5KB — REVERTING, quality over compression","timestamp":1773368380352,"segment":0}
{"run":8,"commit":"235a5db","metric":38000,"metrics":{"hot_path_bytes":14759,"gemini_md_bytes":4712,"orchestrator_bytes":10047,"planner_bytes":5859,"agents_bytes":6759,"commands_bytes":5972},"status":"keep","description":"Add quality test suite (88 checks, 0 errors, 0 warnings) — validates all compressed files","timestamp":1773369393308,"segment":0}
{"run":9,"commit":"3cd57e7","metric":45621,"metrics":{"hot_path_bytes":22380,"gemini_md_bytes":4712,"orchestrator_bytes":17668,"planner_bytes":5859,"agents_bytes":6759,"commands_bytes":5972},"status":"keep","description":"Quality rewrite: orchestrator 10→18KB — fix DAG ambiguity, explicit decision priority, retry counting, handoff location, updatedAt guardrail","timestamp":1773369576040,"segment":0}
{"run":10,"commit":"1cf1aa9","metric":55621,"metrics":{"hot_path_bytes":22380,"gemini_md_bytes":4712,"orchestrator_bytes":17668,"planner_bytes":5859,"agents_bytes":16759,"commands_bytes":5972},"status":"keep","description":"Quality rewrite: all 4 agents (7→17KB) — restore pretty JSON, add guardrails, explicit error paths, pipe warnings","timestamp":1773369725292,"segment":0}
{"run":11,"commit":"9d4439c","metric":59217,"metrics":{"hot_path_bytes":22380,"gemini_md_bytes":4712,"orchestrator_bytes":17668,"planner_bytes":9455,"agents_bytes":16759,"commands_bytes":5972},"status":"keep","description":"Quality rewrite: planner 6→9KB — add JSON examples, concrete DAG steps, services.yaml format, assertion example","timestamp":1773369853554,"segment":0}
{"run":12,"commit":"c4e67d2","metric":59230,"metrics":{"hot_path_bytes":22393,"gemini_md_bytes":4725,"orchestrator_bytes":17668,"planner_bytes":9455,"agents_bytes":16759,"commands_bytes":5972},"status":"keep","description":"Expand quality suite to 100+ checks: cancelled-in-DAG, updatedAt/ISO8601, feature schema, VAL format. Fix GEMINI.md cancelled rule.","timestamp":1773369927314,"segment":0}
{"run":13,"commit":"75b2307","metric":59415,"metrics":{"hot_path_bytes":22393,"gemini_md_bytes":4725,"orchestrator_bytes":17668,"planner_bytes":9455,"agents_bytes":16759,"commands_bytes":5972},"status":"keep","description":"Add pipe warning guardrail to define-worker-skills, tighten quality suite","timestamp":1773370003862,"segment":0}
{"run":14,"commit":"f5db89d","metric":59755,"metrics":{"hot_path_bytes":22733,"gemini_md_bytes":4725,"orchestrator_bytes":18008,"planner_bytes":9455,"agents_bytes":16759,"commands_bytes":5972},"status":"keep","description":"Fix Option A edge case: high-severity + incomplete → treat as Option B failure instead of marking completed","timestamp":1773370124684,"segment":0}
{"run":15,"commit":"11db156","metric":59755,"metrics":{"hot_path_bytes":22733,"gemini_md_bytes":4725,"orchestrator_bytes":18008,"planner_bytes":9455,"agents_bytes":16759,"commands_bytes":5972},"status":"keep","description":"Expand quality suite: Option A+incomplete check, hooks verification, script permissions, 110+ total checks","timestamp":1773370200337,"segment":0}
{"run":16,"commit":"68a05bc","metric":60178,"metrics":{"hot_path_bytes":23156,"gemini_md_bytes":5148,"orchestrator_bytes":18008,"planner_bytes":9455,"agents_bytes":16759,"commands_bytes":5972},"status":"keep","description":"Add ASCII state machine diagram to GEMINI.md for visual clarity, expand decision tree summary","timestamp":1773370254946,"segment":0}
{"run":17,"commit":"e9519b9","metric":60178,"metrics":{"hot_path_bytes":23156,"gemini_md_bytes":5148,"orchestrator_bytes":18008,"planner_bytes":9455,"agents_bytes":16759,"commands_bytes":5972},"status":"keep","description":"Add agent tool name validation to quality suite — verifies all tools in frontmatter are valid Gemini CLI tools","timestamp":1773370308275,"segment":0}
{"run":18,"commit":"a5a20dc","metric":60301,"metrics":{"hot_path_bytes":23156,"gemini_md_bytes":5148,"orchestrator_bytes":18008,"planner_bytes":9455,"agents_bytes":16759,"commands_bytes":5972},"status":"keep","description":"Quality finalization: define-worker-skills checklist (commit, pipe warning), agent tool validation in suite","timestamp":1773370389429,"segment":0}
{"run":19,"commit":"8c2f121","metric":60301,"metrics":{"hot_path_bytes":23156,"gemini_md_bytes":5148,"orchestrator_bytes":18008,"planner_bytes":9455,"agents_bytes":16759,"commands_bytes":5972},"status":"keep","description":"Add scenario trace checks: happy path (7), retry escalation (4), crash recovery (2) — verify instruction coverage","timestamp":1773370433654,"segment":0}
{"run":20,"commit":"9ea0991","metric":60563,"metrics":{"hot_path_bytes":23418,"gemini_md_bytes":5148,"orchestrator_bytes":18270,"planner_bytes":9455,"agents_bytes":16759,"commands_bytes":5972},"status":"keep","description":"Add handoff context to worker prompt construction — include precondition summaries for worker awareness","timestamp":1773370471606,"segment":0}
{"run":21,"commit":"7f3d47e","metric":61096,"metrics":{"hot_path_bytes":23418,"gemini_md_bytes":5148,"orchestrator_bytes":18270,"planner_bytes":9455,"agents_bytes":17292,"commands_bytes":5972},"status":"keep","description":"Add pre-handoff checklist to mission-worker — 6 self-verification steps before producing JSON","timestamp":1773370505939,"segment":0}
{"run":22,"commit":"1aba32c","metric":61096,"metrics":{"hot_path_bytes":23418,"gemini_md_bytes":5148,"orchestrator_bytes":18270,"planner_bytes":9455,"agents_bytes":17292,"commands_bytes":5972},"status":"keep","description":"Add scaffold→validate round-trip test to quality suite — ensures new missions start with valid state","timestamp":1773370593506,"segment":0}
{"run":23,"commit":"22d5d71","metric":61808,"metrics":{"hot_path_bytes":24130,"gemini_md_bytes":5148,"orchestrator_bytes":18982,"planner_bytes":9455,"agents_bytes":17292,"commands_bytes":5972},"status":"keep","description":"Specify all required feature fields for dynamically injected validator features in Step 8.2","timestamp":1773370631136,"segment":0}
{"run":24,"commit":"7f92eb9","metric":62000,"metrics":{"hot_path_bytes":24322,"gemini_md_bytes":5148,"orchestrator_bytes":19174,"planner_bytes":9455,"agents_bytes":17292,"commands_bytes":5972},"status":"keep","description":"Add expectedBehavior/verificationSteps to Option A follow-up features — complete feature schema","timestamp":1773370680687,"segment":0}
{"run":25,"commit":"f45dd6f","metric":62150,"metrics":{"hot_path_bytes":24472,"gemini_md_bytes":5148,"orchestrator_bytes":19324,"planner_bytes":9455,"agents_bytes":17292,"commands_bytes":5972},"status":"keep","description":"Add explicit failure handling for inaccessible workingDirectory in orchestrator prerequisites","timestamp":1773370779117,"segment":0}
{"run":26,"commit":"f4e917d","metric":62289,"metrics":{"hot_path_bytes":24472,"gemini_md_bytes":5148,"orchestrator_bytes":19324,"planner_bytes":9455,"agents_bytes":17431,"commands_bytes":5972},"status":"keep","description":"Add service cleanup guardrail to user-testing-validator — always stop services even on test failure","timestamp":1773370912276,"segment":0}
{"run":27,"commit":"64429e3","metric":62375,"metrics":{"hot_path_bytes":24558,"gemini_md_bytes":5148,"orchestrator_bytes":19410,"planner_bytes":9455,"agents_bytes":17431,"commands_bytes":5972},"status":"keep","description":"Improve Step 3 prompt construction guidance — instruct labeled sections for worker clarity","timestamp":1773370938820,"segment":0}
{"run":28,"commit":"87212e5","metric":62577,"metrics":{"hot_path_bytes":24558,"gemini_md_bytes":5148,"orchestrator_bytes":19410,"planner_bytes":9455,"agents_bytes":17633,"commands_bytes":5972},"status":"keep","description":"CRITICAL FIX: Standardize severity to high/medium/low across all agents — validators used blocking/non_blocking which bypassed decision tree","timestamp":1773371088404,"segment":0}
{"run":29,"commit":"72b852e","metric":62589,"metrics":{"hot_path_bytes":24570,"gemini_md_bytes":5148,"orchestrator_bytes":19422,"planner_bytes":9455,"agents_bytes":17633,"commands_bytes":5972},"status":"keep","description":"Fix Step 8.3 sealing criterion — replace 'non-blocking' with 'Clean Success or Option D' after severity standardization","timestamp":1773371157707,"segment":0}
{"run":30,"commit":"614bd3e","metric":62807,"metrics":{"hot_path_bytes":24788,"gemini_md_bytes":5148,"orchestrator_bytes":19640,"planner_bytes":9455,"agents_bytes":17633,"commands_bytes":5972},"status":"keep","description":"Add explicit timeout/no-response handling in Step 4 — routes to Option B failure path","timestamp":1773371231084,"segment":0}
{"run":31,"commit":"a9a499a","metric":63211,"metrics":{"hot_path_bytes":24788,"gemini_md_bytes":5148,"orchestrator_bytes":19640,"planner_bytes":9859,"agents_bytes":17633,"commands_bytes":5972},"status":"keep","description":"Expand AGENTS.md generation guidance in planner — explicit field descriptions for worker context","timestamp":1773371306605,"segment":0}
{"run":32,"commit":"d749f49","metric":63384,"metrics":{"hot_path_bytes":24961,"gemini_md_bytes":5148,"orchestrator_bytes":19813,"planner_bytes":9859,"agents_bytes":17633,"commands_bytes":5972},"status":"keep","description":"Add message bus context to worker prompt — include recent warnings/discoveries from messages.jsonl","timestamp":1773371359563,"segment":0}
{"run":33,"commit":"53311e4","metric":62777,"metrics":{"hot_path_bytes":24354,"gemini_md_bytes":5148,"orchestrator_bytes":19206,"planner_bytes":9859,"agents_bytes":17633,"commands_bytes":5972},"status":"keep","description":"Deduplicate validation override — orchestrator references command.toml instead of repeating full procedure (-600B)","timestamp":1773371415166,"segment":0}
{"run":34,"commit":"d3143a3","metric":62777,"metrics":{"hot_path_bytes":24354,"gemini_md_bytes":5148,"orchestrator_bytes":19206,"planner_bytes":9859,"agents_bytes":17633,"commands_bytes":5972},"status":"keep","description":"Add cross-file services.yaml format consistency checks — verify planner/agent field alignment (150+ checks total)","timestamp":1773371452044,"segment":0}
{"run":35,"commit":"7fb25a7","metric":62777,"metrics":{"hot_path_bytes":24354,"gemini_md_bytes":5148,"orchestrator_bytes":19206,"planner_bytes":9859,"agents_bytes":17633,"commands_bytes":5972},"status":"keep","description":"Add GEMINI.md ↔ orchestrator state machine cross-validation (all states + decision options must match)","timestamp":1773371502999,"segment":0}
{"run":36,"commit":"9ebe1ca","metric":62777,"metrics":{"hot_path_bytes":24354,"gemini_md_bytes":5148,"orchestrator_bytes":19206,"planner_bytes":9859,"agents_bytes":17633,"commands_bytes":5972},"status":"keep","description":"Fix quality suite section numbering (duplicate §29), add GEMINI.md state machine cross-validation","timestamp":1773371621306,"segment":0}
{"run":37,"commit":"6f7176e","metric":62880,"metrics":{"hot_path_bytes":24457,"gemini_md_bytes":5148,"orchestrator_bytes":19309,"planner_bytes":9859,"agents_bytes":17633,"commands_bytes":5972},"status":"keep","description":"Clarify handoff parsing: find the LAST JSON code block in worker response (handles workers with intermediate JSON output)","timestamp":1773371677317,"segment":0}
{"run":38,"commit":"037e19a","metric":62880,"metrics":{"hot_path_bytes":24457,"gemini_md_bytes":5148,"orchestrator_bytes":19309,"planner_bytes":9859,"agents_bytes":17633,"commands_bytes":5972},"status":"keep","description":"Final comprehensive audit — no broken markdown, no invalid tools, no TODO/FIXME, clean 161-check quality pass","timestamp":1773371735765,"segment":0}
{"run":39,"commit":"35abcb9","metric":63036,"metrics":{"hot_path_bytes":24613,"gemini_md_bytes":5148,"orchestrator_bytes":19465,"planner_bytes":9859,"agents_bytes":17633,"commands_bytes":5972},"status":"keep","description":"Add single-session constraint warning — concurrent access protection for state corruption prevention","timestamp":1773371897049,"segment":0}
{"run":40,"commit":"ecaea7d","metric":63036,"metrics":{"hot_path_bytes":24613,"gemini_md_bytes":5148,"orchestrator_bytes":19465,"planner_bytes":9859,"agents_bytes":17633,"commands_bytes":5972},"status":"keep","description":"Stable equilibrium at 63KB (58.6% reduction) with 161 quality checks, 17+ quality improvements, 0 regressions","timestamp":1773371984566,"segment":0}
{"run":41,"commit":"8913016","metric":63127,"metrics":{"hot_path_bytes":24613,"gemini_md_bytes":5148,"orchestrator_bytes":19465,"planner_bytes":9859,"agents_bytes":17724,"commands_bytes":5972},"status":"keep","description":"Handle no-services case in user-testing-validator — skip service startup for libraries/CLIs","timestamp":1773372124110,"segment":0}
{"run":42,"commit":"7a1e8a0","metric":63570,"metrics":{"hot_path_bytes":25056,"gemini_md_bytes":5591,"orchestrator_bytes":19465,"planner_bytes":9859,"agents_bytes":17724,"commands_bytes":5972},"status":"keep","description":"Add Common Pitfalls section to GEMINI.md — surface critical rules (pipe, severity, sealed, cancelled) at entry point","timestamp":1773372193625,"segment":0}
{"run":43,"commit":"8cef93e","metric":63570,"metrics":{"hot_path_bytes":25056,"gemini_md_bytes":5591,"orchestrator_bytes":19465,"planner_bytes":9859,"agents_bytes":17724,"commands_bytes":5972},"status":"keep","description":"Add quality checks for Common Pitfalls section in GEMINI.md — verify all 4 critical rules are present (165 checks)","timestamp":1773372321861,"segment":0}
{"run":44,"commit":"cbea90e","metric":63715,"metrics":{"hot_path_bytes":25201,"gemini_md_bytes":5591,"orchestrator_bytes":19610,"planner_bytes":9859,"agents_bytes":17724,"commands_bytes":5972},"status":"keep","description":"Fix Option A follow-up for validator features — use code-quality-worker instead of re-assigning to validator skillName","timestamp":1773372388528,"segment":0}
{"run":45,"commit":"58c9741","metric":63715,"metrics":{"hot_path_bytes":25201,"gemini_md_bytes":5591,"orchestrator_bytes":19610,"planner_bytes":9859,"agents_bytes":17724,"commands_bytes":5972},"status":"keep","description":"Add quality check for all-cancelled milestone handling (167+ checks total)","timestamp":1773372455822,"segment":0}
{"run":46,"commit":"6f0cab6","metric":63808,"metrics":{"hot_path_bytes":25294,"gemini_md_bytes":5684,"orchestrator_bytes":19610,"planner_bytes":9859,"agents_bytes":17724,"commands_bytes":5972},"status":"keep","description":"Add Quick Start one-liner to GEMINI.md — immediate 3-command workflow reference for new sessions","timestamp":1773372529638,"segment":0}
{"run":47,"commit":"f82d129","metric":63952,"metrics":{"hot_path_bytes":25294,"gemini_md_bytes":5684,"orchestrator_bytes":19610,"planner_bytes":9859,"agents_bytes":17868,"commands_bytes":5972},"status":"keep","description":"Add pipe warning to both validators — scrutiny and user-testing now match worker agents, all 4 checked in quality suite","timestamp":1773372661742,"segment":0}
{"run":48,"commit":"03f453b","metric":64024,"metrics":{"hot_path_bytes":25366,"gemini_md_bytes":5684,"orchestrator_bytes":19682,"planner_bytes":9859,"agents_bytes":17868,"commands_bytes":5972},"status":"keep","description":"Precise deadlock log event format — specify blockedFeatures and waitingOn fields instead of ellipsis","timestamp":1773372717943,"segment":0}
{"run":49,"commit":"7b299f6","metric":64142,"metrics":{"hot_path_bytes":25366,"gemini_md_bytes":5684,"orchestrator_bytes":19682,"planner_bytes":9977,"agents_bytes":17868,"commands_bytes":5972},"status":"keep","description":"Add dependency chain depth warning to planner DAG check — avoid >5 deep chains that block parallelism","timestamp":1773372791830,"segment":0}
{"run":50,"commit":"b61f897","metric":64142,"metrics":{"hot_path_bytes":25366,"gemini_md_bytes":5684,"orchestrator_bytes":19682,"planner_bytes":9977,"agents_bytes":17868,"commands_bytes":5972},"status":"keep","description":"Experiment 50 stability check — 64KB total, 168 quality checks, 58% reduction from baseline","timestamp":1773372809375,"segment":0}
{"run":51,"commit":"c9b331e","metric":64245,"metrics":{"hot_path_bytes":25469,"gemini_md_bytes":5684,"orchestrator_bytes":19785,"planner_bytes":9977,"agents_bytes":17868,"commands_bytes":5972},"status":"keep","description":"Replace 'counters as needed' with explicit criteria — when to increment completedFeatures vs totalFeatures","timestamp":1773372873894,"segment":0}
{"run":52,"commit":"5a2d4ec","metric":64257,"metrics":{"hot_path_bytes":25469,"gemini_md_bytes":5684,"orchestrator_bytes":19785,"planner_bytes":9989,"agents_bytes":17868,"commands_bytes":5972},"status":"keep","description":"Clarify init.sh chmod step — explicit 'after writing, run chmod +x' instead of parenthetical","timestamp":1773372989512,"segment":0}
