{"run":53,"commit":"5ce86c5","metric":64257,"metrics":{"hot_path_bytes":25469,"gemini_md_bytes":5684,"orchestrator_bytes":19785,"planner_bytes":9989,"agents_bytes":17868,"commands_bytes":5972},"status":"keep","description":"Add feature schema completeness check — verify all 8 required fields documented in planner (176 checks total)","timestamp":1773373053068,"segment":0}
{"run":54,"commit":"254e28b","metric":64257,"metrics":{"hot_path_bytes":25469,"gemini_md_bytes":5684,"orchestrator_bytes":19785,"planner_bytes":9989,"agents_bytes":17868,"commands_bytes":5972},"status":"keep","description":"Add structural check — verify orchestrator Steps 1-8 appear in correct sequential order (177 checks)","timestamp":1773373155598,"segment":0}
{"run":55,"commit":"ef2f1fa","metric":64257,"metrics":{"hot_path_bytes":25469,"gemini_md_bytes":5684,"orchestrator_bytes":19785,"planner_bytes":9989,"agents_bytes":17868,"commands_bytes":5972},"status":"keep","description":"Add structural check for planner Phases 1-7 ordering (178 checks total)","timestamp":1773373188547,"segment":0}
{"run":56,"commit":"d6d262f","metric":64257,"metrics":{"hot_path_bytes":25469,"gemini_md_bytes":5684,"orchestrator_bytes":19785,"planner_bytes":9989,"agents_bytes":17868,"commands_bytes":5972},"status":"keep","description":"Stability check — 64.3KB, 178 quality checks, all systems nominal. Exploring remaining improvement vectors.","timestamp":1773373259116,"segment":0}
{"run":57,"commit":"98d0c28","metric":64293,"metrics":{"hot_path_bytes":25469,"gemini_md_bytes":5684,"orchestrator_bytes":19785,"planner_bytes":9989,"agents_bytes":17868,"commands_bytes":5972},"status":"keep","description":"Precise commit message format in define-worker-skills checklist — include prefix and feature-id pattern","timestamp":1773373311857,"segment":0}
{"run":58,"commit":"4a339d3","metric":64322,"metrics":{"hot_path_bytes":25469,"gemini_md_bytes":5684,"orchestrator_bytes":19785,"planner_bytes":9989,"agents_bytes":17897,"commands_bytes":5972},"status":"keep","description":"Add glob + read_many_files tools to code-quality-worker — match define-worker-skills blueprint","timestamp":1773373377394,"segment":0}
{"run":59,"commit":"15b9b0b","metric":64322,"metrics":{"hot_path_bytes":25469,"gemini_md_bytes":5684,"orchestrator_bytes":19785,"planner_bytes":9989,"agents_bytes":17897,"commands_bytes":5972},"status":"keep","description":"Final status: 64.3KB (57.8% reduction), 178 quality checks, 3 bugs fixed, 20+ guardrails. System at mature equilibrium.","timestamp":1773373474316,"segment":0}
{"run":60,"commit":"e972037","metric":64435,"metrics":{"hot_path_bytes":25469,"gemini_md_bytes":5684,"orchestrator_bytes":19785,"planner_bytes":9989,"agents_bytes":18010,"commands_bytes":5972},"status":"keep","description":"Add services.yaml reference for test framework in TDD step — handles case where framework isn't obvious in project","timestamp":1773373542506,"segment":0}
{"run":61,"commit":"a3f2fb0","metric":64435,"metrics":{"hot_path_bytes":25469,"gemini_md_bytes":5684,"orchestrator_bytes":19785,"planner_bytes":9989,"agents_bytes":18010,"commands_bytes":5972},"status":"keep","description":"Add quality check for mission completion invariant — must require BOTH features done AND milestones sealed (179 checks)","timestamp":1773373634236,"segment":0}
{"run":62,"commit":"93cf118","metric":64435,"metrics":{"hot_path_bytes":25469,"gemini_md_bytes":5684,"orchestrator_bytes":19785,"planner_bytes":9989,"agents_bytes":18010,"commands_bytes":5972},"status":"keep","description":"Final experiment. All ideas exhausted. Deleting ideas backlog and writing final report.","timestamp":1773373799608,"segment":0}
{"run":63,"commit":"564ba58","metric":65116,"metrics":{"hot_path_bytes":26150,"gemini_md_bytes":6365,"orchestrator_bytes":19785,"planner_bytes":9989,"agents_bytes":18010,"commands_bytes":5972},"status":"keep","description":"Add 3 Gemini CLI hooks: state.json write validation (AfterTool), pipe-masking blocker (BeforeTool), sealed milestone protection (BeforeTool). 190 quality checks.","timestamp":1773374167303,"segment":0}
{"run":64,"commit":"57dbf40","metric":65412,"metrics":{"hot_path_bytes":26446,"gemini_md_bytes":6661,"orchestrator_bytes":19785,"planner_bytes":9989,"agents_bytes":18010,"commands_bytes":5972},"status":"keep","description":"Add state-drift detector (AfterAgent) + features.json schema validator (AfterTool). 5 hooks total, 194 quality checks. Hooks now enforce rules that were previously just instructions.","timestamp":1773374375970,"segment":0}
{"run":74,"commit":"0fe3137","metric":65543,"metrics":{"agents_bytes":18010,"commands_bytes":5972,"gemini_md_bytes":6792,"hot_path_bytes":26577,"orchestrator_bytes":19785,"planner_bytes":9989,"scaffold_µs":0,"validate_µs":0,"session_µs":0},"status":"keep","description":"Add PreCompress hook (context compression recovery). 6 hooks total, 196 quality checks.","timestamp":1773374840659,"segment":1}
{"run":75,"commit":"done","metric":65543,"metrics":{"agents_bytes":18010,"commands_bytes":5972,"gemini_md_bytes":6792,"hot_path_bytes":26577,"orchestrator_bytes":19785,"planner_bytes":9989,"scaffold_µs":0,"session_µs":0,"validate_µs":0},"status":"keep","description":"All optimization paths exhausted. 6 hooks, 196 quality checks, 57% reduction. Gemini CLI features (Plan Mode, policies, model routing) evaluated — no additional benefit.","timestamp":1773375022541,"segment":1}
{"run":76,"commit":"f98e876","metric":65543,"metrics":{"scaffold_µs":0,"commands_bytes":5972,"hot_path_bytes":26577,"planner_bytes":9989,"validate_µs":0,"orchestrator_bytes":19785,"session_µs":0,"agents_bytes":18010,"gemini_md_bytes":6792},"status":"keep","description":"Expand quality suite to 211 checks: add worker prompt context (7 items), deadlock detection, budget enforcement, DAG acyclicity, handoff position, updatedAt coverage.","timestamp":1773375498197,"segment":1}
{"run":77,"commit":"f546ed1","metric":65867,"metrics":{"validate_µs":0,"hot_path_bytes":26901,"orchestrator_bytes":20109,"session_µs":0,"agents_bytes":18010,"gemini_md_bytes":6792,"planner_bytes":9989,"commands_bytes":5972,"scaffold_µs":0},"status":"keep","description":"Fix Option C infinite loop: partial completion had no escalation limit, could re-dispatch indefinitely. Now escalates to Option B after 3 partials. +324 bytes for bug fix. 212 quality checks.","timestamp":1773375550815,"segment":1}
{"run":78,"commit":"db16cd2","metric":66338,"metrics":{"validate_µs":0,"hot_path_bytes":27372,"orchestrator_bytes":20580,"planner_bytes":9989,"session_µs":0,"agents_bytes":18010,"scaffold_µs":0,"commands_bytes":5972,"gemini_md_bytes":6792},"status":"keep","description":"Fix dangling precondition bug: typos in precondition IDs caused silent permanent deadlock. Now validated in Step 2 with dangling refs treated as satisfied. 4th bug fixed, 213 quality checks.","timestamp":1773375598163,"segment":1}
{"run":79,"commit":"bb39cfa","metric":66636,"metrics":{"hot_path_bytes":27670,"scaffold_µs":0,"validate_µs":0,"session_µs":0,"agents_bytes":18010,"gemini_md_bytes":6792,"planner_bytes":9989,"commands_bytes":5972,"orchestrator_bytes":20878},"status":"keep","description":"Fix crash recovery counter drift: mid-crash between features.json and state.json write caused permanent counter mismatch. Now reconciles counters during recovery. 5th bug fixed, 214 quality checks.","timestamp":1773375655424,"segment":1}
{"run":80,"commit":"662d31b","metric":66794,"metrics":{"session_µs":0,"hot_path_bytes":27670,"agents_bytes":18010,"scaffold_µs":0,"validate_µs":0,"commands_bytes":5972,"gemini_md_bytes":6792,"orchestrator_bytes":20878,"planner_bytes":10147},"status":"keep","description":"Add duplicate feature ID validation to planner Phase 3. Duplicate IDs cause handoff file conflicts and ambiguous precondition resolution. 215 quality checks.","timestamp":1773375708953,"segment":1}
{"run":81,"commit":"76c6017","metric":66918,"metrics":{"planner_bytes":10147,"gemini_md_bytes":6792,"validate_µs":0,"orchestrator_bytes":21002,"agents_bytes":18010,"hot_path_bytes":27794,"scaffold_µs":0,"session_µs":0,"commands_bytes":5972},"status":"keep","description":"Fix follow-up feature ID collision: Option A fix-* IDs could collide if same feature triggers Option A across multiple dispatch cycles. Now appends epoch suffix on collision. 215 quality checks.","timestamp":1773375750017,"segment":1}
{"run":82,"commit":"8bcfe8a","metric":67085,"metrics":{"orchestrator_bytes":21002,"scaffold_µs":0,"validate_µs":0,"planner_bytes":10147,"commands_bytes":5972,"agents_bytes":18177,"session_µs":0,"gemini_md_bytes":6792,"hot_path_bytes":27794},"status":"keep","description":"Handle missing services.yaml in mission-worker: worker now reports gracefully instead of failing silently. 215 quality checks.","timestamp":1773375795802,"segment":1}
{"run":83,"commit":"8f0d2d6","metric":67195,"metrics":{"hot_path_bytes":27904,"planner_bytes":10147,"validate_µs":0,"agents_bytes":18177,"commands_bytes":5972,"orchestrator_bytes":21112,"session_µs":0,"gemini_md_bytes":6792,"scaffold_µs":0},"status":"keep","description":"Clarify misc milestone initialization: explicitly state to create misc-1 when no misc milestones exist. Prevents ambiguity in Option D first-time use. 215 quality checks.","timestamp":1773375845865,"segment":1}
{"run":84,"commit":"final","metric":67195,"metrics":{"validate_µs":0,"commands_bytes":5972,"orchestrator_bytes":21112,"planner_bytes":10147,"agents_bytes":18177,"hot_path_bytes":27904,"scaffold_µs":0,"session_µs":0,"gemini_md_bytes":6792},"status":"keep","description":"Final state: 67.2KB (-55.9%), 7 hooks, 215 quality checks, 6 bugs fixed. All optimization paths exhausted — remaining compression would sacrifice quality.","timestamp":1773376026851,"segment":1}
{"run":85,"commit":"5cad489","metric":66923,"metrics":{"scaffold_µs":0,"orchestrator_bytes":20840,"commands_bytes":5972,"hot_path_bytes":27632,"session_µs":0,"gemini_md_bytes":6792,"planner_bytes":10147,"validate_µs":0,"agents_bytes":18177},"status":"keep","description":"Restructure decision tree from overlapping triggers to sequential flowchart (Step 6.1→6.2→6.3). Clearer for LLM execution AND saves 272 bytes. 215 quality checks pass.","timestamp":1773376288530,"segment":1}
{"run":86,"commit":"tbl-rev","metric":66923,"metrics":{"gemini_md_bytes":6792,"planner_bytes":10147,"agents_bytes":18177,"orchestrator_bytes":20840,"session_µs":0,"hot_path_bytes":27632,"scaffold_µs":0,"validate_µs":0,"commands_bytes":5972},"status":"discard","description":"REVERT: Table format for validator templates saves 59 bytes but degrades LLM parsing clarity. Tables are visual, LLMs process as text — nested lists are easier to follow. Quality > brevity.","timestamp":1773376372277,"segment":1}
{"run":87,"commit":"fc948b9","metric":66574,"metrics":{"planner_bytes":9798,"scaffold_µs":0,"gemini_md_bytes":6792,"session_µs":0,"validate_µs":0,"agents_bytes":18177,"commands_bytes":5972,"orchestrator_bytes":20840,"hot_path_bytes":27632},"status":"keep","description":"Remove step-by-step topological sort algorithm from planner — Gemini 2.5 Pro knows the algorithm. Just say \"verify via topological sort\". Saves 349 bytes, 215 quality checks pass.","timestamp":1773376453005,"segment":1}
{"run":88,"commit":"eae14bd","metric":66342,"metrics":{"gemini_md_bytes":6792,"agents_bytes":17945,"planner_bytes":9798,"scaffold_µs":0,"session_µs":0,"commands_bytes":5972,"hot_path_bytes":27632,"orchestrator_bytes":20840,"validate_µs":0},"status":"keep","description":"Compact mission-worker handoff JSON template from expanded multi-line to single-line nested objects, matching code-quality-worker style. Saves 232 bytes, same information. 215 quality checks pass.","timestamp":1773376580938,"segment":1}
{"run":89,"commit":"2bdc073","metric":66274,"metrics":{"orchestrator_bytes":20840,"planner_bytes":9798,"session_µs":0,"validate_µs":0,"agents_bytes":17877,"hot_path_bytes":27632,"scaffold_µs":0,"commands_bytes":5972,"gemini_md_bytes":6792},"status":"keep","description":"Compact synthesis report JSON templates in scrutiny-validator and user-testing-validator. Same information, consistent compact style across all agents. Saves 68 bytes, 215 quality checks pass.","timestamp":1773376664286,"segment":1}
{"run":90,"commit":"104a145","metric":66246,"metrics":{"commands_bytes":5972,"agents_bytes":17877,"hot_path_bytes":27632,"session_µs":0,"orchestrator_bytes":20840,"scaffold_µs":0,"gemini_md_bytes":6792,"planner_bytes":9770,"validate_µs":0},"status":"keep","description":"Compact features.json example in planner Phase 7 — merge array bracket onto object line. Saves 28 bytes, readable middle-ground format. 215 quality checks pass.","timestamp":1773376731000,"segment":1}
{"run":91,"commit":"8be9d71","metric":66246,"metrics":{"orchestrator_bytes":20840,"commands_bytes":5972,"hot_path_bytes":27632,"planner_bytes":9770,"session_µs":0,"validate_µs":0,"gemini_md_bytes":6792,"scaffold_µs":0,"agents_bytes":17877},"status":"keep","description":"Final state: 66,246 bytes (−56.5%), 215 quality checks, 7 hooks, 6 bugs fixed. All optimization paths exhausted. Ideas backlog pruned and deleted.","timestamp":1773376922979,"segment":1}
